{
    "$schema": "http://json-schema.org/draft-04/schema#",
    "additionalProperties": false,
    "copyright": "Copyright 2014-2018 Hewlett Packard Enterprise Development, LP.  Portions Copyright 2014-2016 Distributed Management Task Force. All rights reserved.",
    "properties": {
        "@odata.context": {
            "$ref": "Resource.json#/definitions/odatacontext"
        },
        "@odata.etag": {
            "$ref": "Resource.json#/definitions/odataetag"
        },
        "@odata.id": {
            "$ref": "Resource.json#/definitions/odataid"
        },
        "@odata.type": {
            "$ref": "Resource.json#/definitions/odatatype"
        },
        "Description": {
            "$ref": "Resource.json#/definitions/Description"
        },
        "Id": {
            "$ref": "Resource.json#/definitions/Id"
        },
        "Name": {
            "$ref": "Resource.json#/definitions/Name"
        },
        "TreeList": {
            "description": "An ordered sequence of freeze-dried task items that iLO can iterate and schedule.",
            "items": {
                "additionalProperties": false,
                "properties": {
                    "Features": {
                        "description": "Command to execute.",
                        "readonly": false,
                        "type": "string"
                    },
                    "LangKey": {
                        "longDescription": "The value of this property shall be the unique identifier for the resource and it shall be of the form defined in the SPMF specification.",
                        "readonly": true,
                        "type": "string"
                    },
                    "Link": {
                        "longDescription": "The value of this property shall be the unique identifier for the resource and it shall be of the form defined in the SPMF specification.",
                        "readonly": true,
                        "type": "string"
                    },
                    "RightHandMenu": {
                        "description": "Name of the component.",
                        "readonly": false,
                        "type": "string"
                    },
                    "TabSet": {
                        "description": "The unique filename of the component.  This correlates to 'Filename' in the HpeComponent.",
                        "readonly": false,
                        "type": "string"
                    },
                    "Text": {
                        "description": "Command to execute.",
                        "readonly": false,
                        "type": "string"
                    },
                    "Tabs": {
                        "description": "This is an unordered set of permitted updaters that can execute this item.",
                        "items": {
                            "additionalProperties": false,
                            "properties": {
                                "Features": {
                                    "description": "Name of the component.",
                                    "readonly": false,
                                    "type": "string"
                                },
                                "LangKey": {
                                    "longDescription": "The value of this property shall be the unique identifier for the resource and it shall be of the form defined in the SPMF specification.",
                                    "readonly": true,
                                    "type": "string"
                                },
                                "Link": {
                                    "description": "The unique filename of the component.  This correlates to 'Filename' in the HpeComponent.",
                                    "readonly": false,
                                    "type": "string"
                                },
                                "Text": {
                                    "description": "Command to execute.",
                                    "readonly": false,
                                    "type": "string"
                                }
                            },
                            "type": "object"
                        },
                        "readonly": false,
                        "type": "array"
                    }
                },
                "type": "object"
            },
            "readonly": false,
            "type": "array"
        }
    },
    "title": "#HpeiLOGUIService.v1_0_0.HpeiLOGUIService",
    "type": "object"
}